{
  "$defs": {
    "JobState": {
      "enum": [
        "QUEUED",
        "RUNNING",
        "SUCCEEDED",
        "PARTIAL",
        "FAILED",
        "CANCELLED"
      ],
      "title": "JobState",
      "type": "string"
    }
  },
  "$schema": "https://json-schema.org/draft/2020-12/schema",
  "additionalProperties": false,
  "properties": {
    "assessed_compliance_pct": {
      "anyOf": [
        {
          "maximum": 100,
          "minimum": 0,
          "type": "number"
        },
        {
          "type": "null"
        }
      ],
      "title": "Assessed Compliance Pct"
    },
    "assessment_coverage_pct": {
      "anyOf": [
        {
          "maximum": 100,
          "minimum": 0,
          "type": "number"
        },
        {
          "type": "null"
        }
      ],
      "title": "Assessment Coverage Pct"
    },
    "completed_assets": {
      "minimum": 0,
      "title": "Completed Assets",
      "type": "integer"
    },
    "created_at": {
      "pattern": "^\\d{4}-\\d{2}-\\d{2}T\\d{2}:\\d{2}:\\d{2}(\\.\\d+)?Z$",
      "title": "Created At",
      "type": "string"
    },
    "error_count": {
      "minimum": 0,
      "title": "Error Count",
      "type": "integer"
    },
    "fail_count": {
      "minimum": 0,
      "title": "Fail Count",
      "type": "integer"
    },
    "manual_review_count": {
      "minimum": 0,
      "title": "Manual Review Count",
      "type": "integer"
    },
    "not_applicable_count": {
      "minimum": 0,
      "title": "Not Applicable Count",
      "type": "integer"
    },
    "not_assessed_count": {
      "minimum": 0,
      "title": "Not Assessed Count",
      "type": "integer"
    },
    "org_id": {
      "format": "uuid",
      "title": "Org Id",
      "type": "string"
    },
    "pass_count": {
      "minimum": 0,
      "title": "Pass Count",
      "type": "integer"
    },
    "requested_assets": {
      "minimum": 0,
      "title": "Requested Assets",
      "type": "integer"
    },
    "scan_id": {
      "format": "uuid",
      "title": "Scan Id",
      "type": "string"
    },
    "schema_version": {
      "const": "1.0.0",
      "title": "Schema Version",
      "type": "string"
    },
    "status": {
      "$ref": "#/$defs/JobState"
    }
  },
  "required": [
    "pass_count",
    "fail_count",
    "not_applicable_count",
    "manual_review_count",
    "error_count",
    "not_assessed_count",
    "assessed_compliance_pct",
    "assessment_coverage_pct",
    "schema_version",
    "org_id",
    "scan_id",
    "status",
    "requested_assets",
    "completed_assets",
    "created_at"
  ],
  "title": "Scan",
  "type": "object"
}
