{
  "assessed_compliance_pct": 75.0,
  "assessment_coverage_pct": 50.0,
  "completed_assets": 1,
  "created_at": "2026-10-29T00:00:00Z",
  "error_count": 1,
  "fail_count": 1,
  "manual_review_count": 1,
  "not_applicable_count": 1,
  "not_assessed_count": 2,
  "org_id": "00000000-0000-0000-0000-000000000001",
  "pass_count": 3,
  "requested_assets": 3,
  "scan_id": "00000000-0000-0000-0000-000000000003",
  "schema_version": "1.0.0",
  "status": "RUNNING"
}
